{
  "schemaVersion": 1,
  "rev": 1,
  "seq": 0,
  "project": {
    "name": "{{project_name}}",
    "slug": "project",
    "root": "design",
    "lang": "en",
    "dir": "ltr",
    "createdAt": "1970-01-01T00:00:00.000Z"
  },
  "status": "draft",
  "tokensHash": "",
  "contrastPairs": [
    {
      "foreground": "content",
      "background": "background",
      "target": 4.5
    },
    {
      "foreground": "content-muted",
      "background": "background",
      "target": 4.5
    },
    {
      "foreground": "content",
      "background": "surface",
      "target": 4.5
    },
    {
      "foreground": "on-primary",
      "background": "primary",
      "target": 4.5
    },
    {
      "foreground": "on-accent",
      "background": "accent",
      "target": 4.5
    },
    {
      "foreground": "border-strong",
      "background": "surface",
      "target": 3
    },
    {
      "foreground": "focus",
      "background": "background",
      "target": 3
    }
  ],
  "generator": {
    "kind": "agent"
  },
  "screens": [],
  "requests": [],
  "events": [],
  "gates": {
    "screens": {
      "passed": false
    }
  },
  "approvals": [],
  "provenance": {
    "DESIGN.md": "",
    "tokens.css": "",
    "preview.html": ""
  }
}
